[
  {
    "id": "ACT-CUSTOMER",
    "name": "顧客",
    "role": "サービス予約者",
    "description": "飲食店、美容室、医療機関などのサービスを予約・利用する役割。予約サイトにアクセスし、予約の登録・変更・キャンセルを行う。",
    "goals": [
      "希望の日時にサービスを予約する",
      "空き状況を確認する",
      "予約内容を変更・キャンセルする",
      "予約を確認する"
    ],
    "responsibilities": [
      "正確な情報を入力する",
      "予約時間を守る",
      "変更・キャンセルは期限内に行う"
    ],
    "relatedStakeholders": ["SH-CUSTOMER"]
  },
  {
    "id": "ACT-STAFF",
    "name": "店舗スタッフ",
    "role": "予約管理・顧客対応",
    "description": "予約管理画面から予約状況を確認し、必要に応じて予約の調整や顧客情報の参照を行う。サービス提供時には予約ステータスを更新し、受付処理を行う。",
    "goals": [
      "予約状況を確認する",
      "予約を調整する",
      "顧客情報を参照する",
      "来店受付を処理する",
      "予約ステータスを更新する"
    ],
    "responsibilities": [
      "予約情報を正確に管理する",
      "顧客に適切な対応をする",
      "予約ステータスを適時更新する"
    ],
    "relatedStakeholders": ["SH-STAFF"]
  },
  {
    "id": "ACT-MANAGER",
    "name": "店舗管理者",
    "role": "店舗運営管理",
    "description": "予約枠の設定、営業カレンダーの管理、スタッフの権限管理、予約実績のレポート確認を行う。経営判断のためのデータ分析も実施する。",
    "goals": [
      "営業日・営業時間を設定する",
      "予約枠を管理する",
      "予約実績を分析する",
      "スタッフの権限を管理する"
    ],
    "responsibilities": [
      "適切な予約枠を設定する",
      "営業カレンダーを維持する",
      "データに基づいて経営判断する",
      "スタッフの権限を適切に管理する"
    ],
    "relatedStakeholders": ["SH-MANAGER"]
  },
  {
    "id": "ACT-SYSADMIN",
    "name": "システム管理者",
    "role": "システム運用保守",
    "description": "システムの稼働状況監視、バックアップ管理、セキュリティ維持、障害対応を行う。管理画面からシステム設定やログを確認する。",
    "goals": [
      "システムの稼働状況を監視する",
      "バックアップを管理する",
      "セキュリティを維持する",
      "障害に対応する"
    ],
    "responsibilities": [
      "システムの安定稼働を保証する",
      "データを保護する",
      "セキュリティインシデントに対応する",
      "システム設定を適切に管理する"
    ],
    "relatedStakeholders": ["SH-SYSADMIN"]
  }
]
